# of Events	Location	Team Name	Nickname	Team #	OPR Rank	Max OPR	ChampionshipDivision	CentralIllinois	Palmetto	Alamo	GreaterTorontoWest	InlandEmpire	MICenterLine	MISouthfield	NEGraniteState	PNWAuburnMountainview	MARMtOlive	MARHatboroHorsham	Israel	GreaterTorontoEast	Arkansas	SanDiego	Crossroads	LakeSuperior	NorthernLights	HubCity	NEUNH	CentralValley	MIKetteringU	MIGullLake	PNWOregonCity	PNWGlacierPeak	NEGroton	MexicoCity	Sacramento	Orlando	GreaterKansasCity	St.Louis	NorthCarolina	NewYorkTechValley	Dallas	Utah	NEWPI	MIEscanaba	MIHowell	MARSpringsideChestnutHill	PNWEasternWashingtonU	PNWMt.Vernon	MARClifton	Waterloo	Montreal	Arizona	LosAngeles	Boilermaker	Buckeye	Virginia	Wisconsin	MIWestMichigan	MIGreatLakesBayRegion	MITraverseCity	PNWWilsonville	NERhodeIsland	PNWShorewood	NESouthington	MARLenape-Seneca	NorthBay	Peachtree	Hawaii	Minnesota10000Lakes	MinnesotaNorthStar	SBPLILongIsland	FingerLakes	QueenCity	Oklahoma	GreaterPittsburgh	SmokyMountains	GreaterDC	NENortheasternU	MILivonia	MISt.Joseph	MIWaterford	PNWAuburn	PNWCentralWashingtonU	NEHartford	MARBridgewaterRaritan	WesternCanada	WindsorEssexGreatLakes	SiliconValley	Colorado	SouthFlorida	Midwest	Bayou	Chesapeake	LasVegas	NewYorkCity	LoneStar	NEPineTree	MiLansing	MIBedford	MITroy	PNWOregonStateU	NewEnglandRegion	MichiganState	AutodeskPNW	MidAtlanticRegion	Archimedes	Curie	Galileo	Newton
																																																																																																													
	, MI USA					-1	0	40	67	64	30	40	39	40	39	32	38	40	53	48	39	60	45	57	55	42	36	45	40	40	35	32	33	38	54	62	58	45	54	38	45	48	39	36	40	34	31	28	31	30	41	49	66	40	54	64	60	40	40	40	31	37	33	32	39	36	64	39	63	60	50	49	47	62	48	49	50	40	40	39	40	36	34	39	46	35	40	58	52	47	53	57	54	50	66	55	38	40	39	40	30	53	64	63	55	100	100	100	100
4	St. Catharines, ON Canada	Innovation First International/General Motors St. Catharines Powertrain & Governor Simcoe Secondary School	Simbotics	1114	1	152.1	Newton													152.059753408863																														112.737299558547																																					94.5112223940801																						84.1692405229774
4	Armada, MI USA	The Chrysler Foundation/Ford Motor Company/Master Pneumatic, Inc/Miljoco Corporation/Richmond Rotary/NuStep, Inc/SMART I.T. Services/The Armada Fair & The Macomb Academy of Arts & Sciences	The Fighting Pi	1718	2	149.7	Curie						67.9274719627156																																																																				149.653428245081																						90.8955792319017				109.673009082198		
4	San Jose, CA USA	NASA Ames Research Center/Lockheed Martin/The Mercadante Family/Ooyala/Qualcomm/HP/West Coast Products/The Magarelli Family/The Yun Family/Google/Modern Machine/The Gebhart Family/Aditazz/Vivid-Hosting/BAE Systems/Gilbert Spray Coat/Pacific Coast Metal/Polytec Products/S&S Welding/Good Plastics/Team Whyachi/Advanced Welding/The Jimenez Family & Bellarmine College Preparatory	The Cheesy Poofs	254	3	132.2	Curie																					91.3061354570315																						126.385561344222																																						95.1057720220602																			132.216334860418		
3	Winnebago, IL USA	United Technologies Corporation / Woodward / In Memory of Roger W. Freeman / Dale Falconer & Winnebago High School	Winnovation	1625	4	130.8	Archimedes																																																		62.691670001552																																		130.824130032334															99.6798516656192			
3	Calgary, AB Canada	Qsine Corporation Limited/Aaron Machine Shop/Bishop Carroll High School & Alberta Tech Alliance	Alberta Tech Alliance (ATA)	4334	5	130.5	Curie																																			43.7351040253577																																												130.52193244241																					62.5348738958252		
4	Sedalia, MO USA	NASA / Ditzfeld Transfer / Maxion Wheels / W&M Welding / Waterloo Industries, Inc. & Smith-Cotton High School	Team SCREAM	4522	6	128.4	Curie														70.7740224088006																128.413275229239																																					56.7498582769306																																	43.1483233516164		
4	League City, TX USA	NASA-JSC & Clear Creek ISD	Robonauts	118	7	127.6	Curie			79.9932421032189																											115.344392192312																																																											127.578620335635											71.4847172364609		
5	Bloomfield Hills, MI USA	Comau / AVL / General Motors / Nissan / Norgren, Inc. / Eco-Bat / QUEXCO / Solidworks / TARDEC / Michigan Fiberglass / Anixter / Copeland-Gibson / Techshop / Lawrence Technological University / Stylmark / Gorman's Gallery / Koshido Design & International Academy	Las Guerrillas	469	8	122.3	Curie																																						70.5439850610229																																				88.1618771248483																			72.8993156828286			122.297197491151				121.404255692977		
5	Auburn Hills, MI USA	Chrysler LLC/The Chrysler Foundation/BAE Systems/TI Automotive/JDM Consulting & Notre Dame Preparatory School	Killer Bees	33	9	121.9	Archimedes							103.535835445675																																													50.6975112440892																																									106.637562610093			53.931564887644			121.904276437505			
3	Stoney Creek, ON Canada	CNC Woodcraft / Gridpath Solutions / Juice Matters & Orchard Park S.S. & HWDSB	OP Robotics	2056	10	120.3	Archimedes																																											90.0890855103886																																					120.260927606508																			119.041345343515			
4	Waialua, HI USA	McInerny Foundation / Hawaii P-20 College Access Grant / Castle & Cooke, Inc. Dole Plantation / R.M. Towill Foundation / Russell Figueiroa / Hawaiian Electric Company / Waialua Federal Credit Union / Monsanto Hawaii / Oakley, Inc. / Turtle Bay Foundation / LockHeed Martin / AFCEA Hawaii / BAE Systems / Friends of Hawaii Robotics / HI Central North Complex / HawaiiUSA Federal Credit Union / Waialua High School Foundation / Waialua Hongwanji Mission / Arthur Kobayashi, OD / National Instruments / Waialua Lions Club / Hawaiian Dredging / Dole Food Company of Hawaii / Hawaii Visitors Bureau / Pioneer Hi-Bred International / Coca Cola Hawaii / Gordon Kuwada / Kenneth Koga / Matsuo Takabuki / The Oishi Family & Waialua High School	Hawaiian Kids	359	11	119.6	Curie																		88.2551128437407																82.9748996967494																											119.639848613167																																							106.716507495619		
3	Lee's Summit, MO USA	TradeBot / Venture Industrial Products / National Instruments / Dr. Thomas G. Cates III / Intuitive Surgical, Inc / Michael & Jayne Hartwig / Delmer & Ruth Harris / Honeywell FM&T / Proliant Group / KC STEM Alliance / Metals USA / Deauville Apartments / Paradise Park / Kastle Grinding / Billy Goat Industries / CK Enterprises / Northpoint Development / U.S Engineering & Lee's Summit West High School	Team Titanium	1986	12	119.0	Newton	81.9995328220179																													119.038051937773																																																																								80.5104897088586
5	Milford, MI USA	General Motors Milford Proving Ground & Huron Valley Schools	The HOT Team	67	13	118.4	Galileo																																						82.8414046146954																																				118.404135980871																	88.9129869342525					109.655882172282					89.2737324284079	
5	Clarkston, MI USA	The Chrysler Foundation/BorgWarner/Mclaren Health Care/BAE SYSTEMS/Smith's Disposal/Recticel North America Inc./Magna Powertrain/Genisys Credit Union & Clarkston Schools & CSMTech Academy Clarkston High School	Team RUSH	27	14	118.3	Archimedes																		62.2437639414776																				103.508687220908																																			106.113203413205																							91.3700631826443			118.290806953282			
2	Phoenix, AZ USA	DLR Group / The Butler Family Foundation / Science Foundation Arizona / Intel / MarZee Water Jet Services / Bank of America / Sun Eagle Corporation / Sling Rings / Arizona Charitable Tax Credit Donors / Critical Mass Communications / Critical Mass Communications / Microchip / The Boeing Company / Fast Signs / Southwest Fasteners & Carl Hayden High School	Falcon Robotics	842	15	117.8	Curie																																													117.753983648643																																																							84.0909240776109		
4	Katy, TX USA	BP America/Oceaneering/Texas Workforce Commission & Cinco Ranch High School	CRyptonite	624	16	113.2	Curie			96.7049903459206																										72.6082132092865																																																												72.5215000024505											113.168229197537		
4	Greenville, TX USA	Innovation First International/L-3 Mission Integration & Greenville High School	Robowranglers	148	17	112.8	Galileo			58.2511682560389																															108.651525097661																																																							112.764651664902												92.9304661970979	
3	Stuart, FL USA	Pratt & Whitney / Florida Power & Light / Aerojet Rocketdyne / Education Foundation of Martin County & Jensen Beach High School & Martin County High School & South Fork High School & Clark Advanced Learning Center (High School)	S.P.A.M.	180	18	112.6	Curie																													77.0194376408584																																																						112.611877124753																	88.5181934934634		
3	Leonardtown, MD USA	The Boeing Company/The Patuxent Partnership/BAE Systems/SAIC/National Instruments/Naval Air Systems Command/Booz Allen Hamilton & Dr. James A. Forrest Career & Technology Center High School	The RoboBees	836	19	110.6	Galileo																																81.7437183185568																																				89.2585028606998																																	110.636360670313	
5	York, PA USA	BAE SYSTEMS / NRG Energy / Fred Dallmeyer Fund of York County Community Fundation / Coupling Corporation of America / St. Onge Company / JMT Engineering & TechFire Robotics of York	TechFire	225	20	108.4	Galileo																																							52.2947560266845																			80.5159441715279												108.350043620788																												88.9036120228865			55.1804956125513	
3	The Woodlands, TX USA	Innovation First International/Halliburton/Anadarko/NEMA Enclosures/Texas Workforce Commission/Crow Corp/ABB & Conroe ISD	Texas Torque	1477	21	108.3	Archimedes																																		34.7276258492241																																																							108.290615249894										62.9526033188763			
3	Searcy, AR USA	NASA/jcpenney/Excel Ford/White County Medical Center/Arkansas FIRST & Harding Academy	Breakaway	3937	22	108.2	Galileo														57.4952082754055																																																																							108.175291782947																48.7887481285734	
3	Saint Charles, IL USA	Genesis Automation/Milwaukee School Of Engineering/Ace Metal Crafts/Center Tool Company/SMC/Balluff/Enersys & Youth Robotics and STEM Education Foundation	PWNAGE	2451	23	107.9	Curie	44.7206151074855																																																																																			102.977225578081																107.933200197423		
3	San Diego, CA USA	Qualcomm / Leidos / NASA / Black Mountain Family Dentistry / WowWee / NASSCO / SolidWorks / SolidCAM / Harper Construction / BrecoFlex / Ababa Bolt / Environmental Lights & Francis Parker High School	WARLords	2485	24	107.9	Archimedes															107.933112881934																																																																								85.6663412047081												96.2460022718561			
4	Davis, CA USA	UCD Chancellor's Office / Ron DuPratt Ford / Davis Senior High School / Da Vinci HS Booster Club / UCD School of Biological Sciences / UCD Vet School / UCD College of Engineering / UCD College of Agriculture and Environmental Science / Martin's Metal Fabrication / UCD College of Mathematical and Physical Science / Aerometals / UCD Department of Social Sciences / DMG Mori Seiki / UCD School of Medicine / UCD School of Nursing / UCD School of Education / Hoffmann Automotive / Aries Surgical & Davis Joint Unified School District	Citrus Circuits	1678	25	107.9	Newton					74.5943104323749																							92.7257526018714																																																					107.893340548651																					92.7358732914528
3	Mountain Home, AR USA	Baxter Healthcare Corporation/The Science and Technology Group/Arkansas FIRST & Mountain Home Public Schools	Bomb Squad	16	26	107.6	Newton														92.4283570076186																																																				107.618835737438																																				73.2032545432633
2	Longmont, CO USA	Seagate Technology & Career Development Center	Up-A-Creek Robotics	1619	27	106.6																																				87.9363655014471																																															106.626844392608																				
4	Washington, MI USA	RCM Inc./General Motors/Cross The Road Electronics & Romeo Community Schools	Byting Bulldogs	3539	28	106.0	Newton																																																																										66.27951445183																			106.015423468201			81.5516778957109						92.9624592454276
3	Waterloo, ON Canada	XL Tool & St. David Catholic Secondary School	Team Dave	3683	29	106.0	Galileo													105.961236058671																														84.7986676348221																																																										64.0328240608739	
5	Fremont, MI USA	Newaygo County Regional Educational Service Agency/The Fremont Area Community Foundation/The Gerber Foundation/Kaydon Bearings/The people of Newaygo County & Newaygo County RESA	NC GEARS	1918	30	105.5	Archimedes																							74.6611452130807																												73.6634313053514																																								105.471607703667					80.8830383414942			85.0991860484061			
4	Robbinsville, NJ USA	CCL Label / New York Society of Cosmetic Chemists / Siemens / Lockheed Martin / Citi / Nordson Corporation / Gaum Incorporated / RAS Process Equipment / Carfaro Railing / GrabCAD / SRI International / McGraw-Hill Financial / DesignTree / Gilbane Inc. / Elite Dental Care / APCO Petroleum Corporation / Robbinsville Education Association / Robbinsville Education Foundation & Robbinsville High School	Nemesis	2590	31	105.0	Archimedes											78.9449959487915																																															105.033362792148																																								75.7422115808525	103.3700787385			
3	Lockport, NY USA	Delphi / GM / Contracts Unlimited / HDS Industrial Design-Drafting / Superior Group & Lockport High School	Warlocks	1507	32	103.7	Newton																																																92.1364565332978																	103.735063654915																																					88.606717325664
3	Las Vegas, NV USA	S & S Philpott LLC. / Lowes / Nevada YESCO LLC. / Lenovo / Albertsons / PTC / ITT Technical Institute / VSR Industries & Cimarron-Memorial High School	HIGHROLLERS	987	33	103.5	Curie															103.529018677006																																																																								82.0717714497147													77.0776911025434		
4	Stayner, ON Canada	JT Snowmobile / Page Graphics / Weld Experts / Clearview Township / Stayner Kinsmen / Stayner Lions Club & Cybergnomes Robotics Team 2013	Cybergnomes	2013	34	103.1	Curie													53.2327489190369																																														54.4271326215092																				103.12725284145																					54.6145422164442		
4	Lancaster, CA USA	NASA Dryden Flight Research Center/Lockheed Martin/Northrop Grumman/JT3/ITEA/BAE Systems/Aeroviroment/West Coast Products/Pacific Coast Powder Coating & Lancaster High School & Antelope Valley Union High School District	Eagle Robotics	399	35	101.8	Archimedes					60.1989345242631																														51.6564494686892																																																				70.501674089405												101.820876530116			
6	Madison Heights, MI USA	NDEP/General Motors/The Chrysler Foundation & Bishop Foley Catholic High School	The Foley Freeze	910	36	101.0	Newton						38.1099394513126																																42.9982295811316										101.03661557506																																													86.6235690550701			47.6888785100949						89.8746102061194
3	Peoria, IL USA	Caterpillar Inc & Limestone Community High School	Argos	1756	37	100.8	Galileo	59.9148929125478																																														100.766781431225																																																						77.5737676516505	
3	Toronto, ON Canada	Hatch/Thales/H. Hatsios Investments/Extrude-A-Trim/Tsubaki & Crescent School	The Coyotes	610	38	100.5	Newton				81.1503328590648																																																							100.504164975093																																											81.6559501211484
5	Mississauga, ON Canada	General Motors of Canada / Pratt & Whitney / Templeton & Sons / christie / Hydrogenics / Trans Canada & Rick Hansen SS & Theory6	THEORY6	1241	39	100.5	Curie				82.1304602718241									66.9882340661531																														81.8665568803331																																					100.499271723053																				64.730567350701		
3	San Jose, CA USA	FUHS Foundation/Symantec/NASA/Teradata Corp/Qualcomm/Western Digital/The Brin Wojcicki Foundation/Google/PTC/Intuitive Surgical Inc/Makineni Family/Vanderbend Manufacturing/Therma Corp./Exatron Inc/Lux Manufacturing & Lynbrook High School	The Funky Monkeys	846	40	100.1	Newton																																																77.7279143923562																																	69.7998600254253																					100.130707243802
4	Hillsboro, OR USA	NASA / Valley Machine / Entro Industries / Hillsboro School District / Christmas Mountain Choose and Cut / Hillsboro Optimists Club / 1st Tech Federal Credit Union / Resource One & Glencoe High School	Shockwave	4488	41	100.1	Galileo																								74.5287383532795																														75.5503759153067																																											100.076928844153				79.2024414693061	
3	Allendale, MI USA	PTC & Allendale High School	TriSonics	4003	42	99.3																								32.9356447755025																												99.330960979715																																													44.0201019953083						
3	Honolulu, HI USA	"Hawaiian Electric Company / RHT Enterprises / Leidos / Eyvinne C. ""Pony"" Lee / McKinley Alumni Association / BAE Systems & McKinley High School"	Team Kika Mana	368	43	99.2	Newton																																																													99.2284102020816																				89.9887873201787																					80.9525726649274
3	Mauldin, SC USA	Jean Aldridge / Synnex / Greenville County Schools / Hendricks Fabrication / Greenville Technical College / DunRight Services / aeSolutions / Advance SC & Mauldin High School & Hillcrest High School & Brashier Middle College Charter High School	Flash	1319	44	99.1			36.4525845419159																																																										99.0541507063713																									80.14673909545																	
2	Hammond, IN USA	School City of Hammond/Caterpillar/City of Hammond & School City of Hammond	Team Hammond	71	45	99.0																	57.4125440155661																																																																				98.9935608031147																		
4	Holland, MI USA	World Class Prototypes/Johnson Controls/Metal Flow/Agritek/Twisthink & Holland Christian High School	Team R.O.B.O.T.I.C.S.	107	46	98.9								74.508821727339																														98.9429641149304														65.6063371758356																																													81.5003507072332						
1	Sugar Hill, GA USA	NASA/Meggitt Training Systems/Nordson Corp./Laser Craft, Inc/Gwinnett County Public Schools & Lanier High School	Mechanical Bulls	4509	47	98.6164398193359																																																													98.616438359473																																										
3	Marshall, VA USA	TE Connectivity / General Dynamics / SAIC & Fresta Valley Christian High School	Fresta Valley Robotics Club	1731	48	97.6	Newton																																																57.2171940544506																						97.6049581292437																																53.6659450168612
4	Southington, CT USA	United Technologies / Mohawk Northeast / Conveyco / Pyramid Technologies / Plainville Electrical Products Company / Tiger Enterprises / Saucier Mechanical Services & Southington High School	Cyber Knights	195	49	97.6	Archimedes																										60.0643716239944																															97.5518982606974																																						96.6249011128142				94.6106812085236			
5	Grand Blanc, MI USA	General Motors / Premier Tooling Systems / Chrysler Foundation / Davison Tool & Engineering, L.L.C. / UnyPOS Manufacturing / Katcon USA / The Robot Space & Grand Blanc High School	EngiNERDs	2337	50	97.1	Galileo																						71.3925442859855																																																			77.8121114420218																				70.6735305192971			97.0708979561942					80.3446262961848	
2	Waterford, MI USA	General Motors Foundation / Advanced Defense Vehicle Systems / Alro Steel / Diversified Fabrications / Ellsworth Tools / Federal Mogul / Michigan Department of Education / Paulson's Audio & Video / Property Care Inc. & Waterford Mott High School	The Corsairs	2612	51	96.9																																							19.0390794157427																																				96.8879105582433																												
3	Newport News, VA USA	US Army Research Laboratory / NASA / The Boeing Company / NDEP / SPAWAR Systems Center Atlantic / Booz Allen Hamilton / BAE Systems Norfolk Ship Repair / RichTech's Women in Technology & Menchville High School	Triple Helix	2363	52	96.5	Galileo																																																	66.76666605114																																					96.4918444516342															62.6969444624881	
5	Ortonville, MI USA	General Motors Engineering Structural Development Laboratories/Continental Automotive Systems & Brandon High School & Holly High School	Truck Town Thunder	68	53	96.4	Curie																																																				45.2942805009156																						52.2173912718759																		50.4389114383046				96.3959852752861				93.2679722159752		
5	Temperance, MI USA	Bill & Cheryl Sommers / La-Z-Boy Inc. / RD Tool & Manufacturing / Integration Partners / InkHut.com / DTE Energy Foundation / Marathon Petroleum Company LP / VDS / ORT / Heidtman Steel / Steel Dimensions & Bedford High School	Bedford Express	1023	54	95.9	Galileo						73.2622148585314																															76.1062230055543																																																							83.7762741830967				90.8036197298303					95.9451252239773	
3	Montréal, QC Canada	BCGO / APCRA / ABB / CAE / Stylo.ca / SOLUTIONS BIZ / Desjardins Caisse populaire du Sault-au-Recollet / Desjardins Caisse populaire de Jean-Talon-Papineau / CONTANT.ca & College Regina Assumpta	Tech for Kids	3990	55	95.3	Curie																																	38.577889213971											95.3226082240131																																																								54.9008522887318		
2	Oswego, IL USA	Caterpillar Inc. & Oswego District 308 high schools	Gear It Forward	2338	56	95.1																	49.6657918727506																																																																				95.1422620032267																		
3	Mountain View, CA USA	NASA Ames Research Center / Google / St. Jude Medical Foundation / Abbott Fund / DSS SolidWorks / The Linley Group / Mountain View High School PTSA / The Crispie Family / Intuitive Surgical / Creative Manufacturing Solutions / Screen-Tech / Group Manufacturing Services / Whizz Systems, Inc. & Mountain View High School	Spartan Robotics	971	57	94.5	Newton																												94.5433921948231																																																					90.9733230073934																					72.2310685464299
5	Ambler, PA USA	The Boeing Company/DOW Chemical/Lockheed Martin/Cobham Defense Electronics/BAE Systems/Comcast Cable/Johnson & Johnson/Janssen BioTech/Sea Box Inc./The Inventor Shop & Wissahickon High School	Miss Daisy	341	58	94.0	Newton											12.9382434049782																																															49.841976202819							65.5989209075665																																	48.9722911278015				94.0181846431666
2	West Lafayette, IN USA	Purdue FIRST Programs/Caterpillar & West Lafayette Jr-Sr High School	Westside Boiler Invasion	461	59	93.5																	71.3384940728276																															93.5025026055958																																																							
3	Riviera Beach, FL USA	UTC/EDF/Lockheed Martin/FP&L/Florida Turbine Technologies & Suncoast High School	The Children of the Swamp	179	60	93.4	Galileo																													43.9673646686892																																																						93.3638303929651																		54.522447029072	
2	Vicksburg, MS USA	US Army Engineer Research & Development Center / Vicksburg-Warren School District / Entergy Grand Gulf / NASA / National Defense Education Program / Lockheed Martin & Warren Central High School & St. Aloysius Catholic High School & Vicksburg High School & Vicksburg Home Schools	Siege Robotics	456	61	93.1																														30.5945952616024																																																								93.1470158674103																	
3	Woodbury, MN USA	3M & Woodbury Math & Science Academy	The Fighting Calculators	2175	62	93.1	Archimedes																		75.2866759396588																																													93.0579362619896																																				65.6890634130827			
3	Dana Point, CA USA	Applied Medical / Lasergraphics / The Boeing Company / Western Digital / DeNault Hardware / Microsoft Store & Heritage Christian School & Code Orange Inc.	Code Orange	3476	63	92.7	Curie															87.8106865881834																																																																								92.7205069811399													82.1273617833327		
