3	Spokane, WA USA	Eastern Washington University & Itron / Washington First & Itron / Wagstaff / F5 / Haskins Steel / CenturyLink / Microsoft & West Valley High School	CHUCK	2147	1130	31.7																																									20.7222244399412																																			16.3899101880849																						31.6856686650004					
2	Honeoye Falls, NY USA	General Motors / Xerox / Johnson and Johnson Services / NASA & Honeoye Falls-Lima High School	CougarTech	2228	1131	31.7																																		31.6782977725529																																11.0323066121566																																					
1	Central Islip, NY USA	Arrow Electronics & Central Islip Senior High School	CIBorgs	4006	1132	31.7																																																																	31.6564018167612																																						
1	Willmar, MN USA	Jennie-O Turkey Store / Willmar foundation & Willmar High School	WARPSPEED	4239	1133	31.6																																																																31.6493370987308																																							
2	Carrollton, TX USA	jcpenney/Texas Workforce Commission & Prince of Peace Christian School	RoboPOP	3802	1134	31.6				7.1242359353313																															31.6296749085083																																																																				
3	Spokane, WA USA	Ferris High Scool	SaxonBots	5111	1135	31.6																																									6.8197855511747																																				22.9084768576978																					31.6072302439523					
2	Hampton, VA USA	NDEP/SPAWAR Systems Center Atlantic/Lockheed Martin/BAE Systems -Norfolk Ship Repair/Community Knights/Alcoa Howmet/Analytical Mechanics Associates/ECPI Newport News Campus/Georgia Tech Research Institute/Huntington Ingalls Industries/Newport News Shipbuilding Apprentice School/Hampton City Schools & Phoebus High School	Phantom Mentalist	2028	1136	31.6																																																		8.0192632363183																			31.5971264143423																																		
2	Yonkers, NY USA	The Economos Foundation / Con Edison / NASA & Yonkers High School	Mechadogs	5123	1137	31.5933685302734	Archimedes																																																																																								8.1270174339541											31.5933675918607			
1	Hutchinson, MN USA	3M & Hutchinson High School- Tigerbots	Tigers	2509	1138	31.6																																																															31.5587093537281																																								
2	Waldorf, MD USA	Charles County Public Schools	Robo Raptors	3650	1139	31.5																																																																							31.5482060195898																10.2488685888834																
2	Brampton, ON Canada	General Motors of Canada & Chinguacousy S.S.	Chingbotics	3560	1140	31.5					31.5423740979187																																																																												22.7190357068																						
2	Flint, MI USA	JC's Automotive / Creative Foam Corporation / ToneCat Inc DBA Matco Tools / Cathy Hite & Kearsley High School	Hornets	5150	1141	31.5066394805908																							31.506639034737																														22.9639388403888																																																		
2	Orlando, FL USA	Walt Disney World/Fluid Power Society & Colonial High School	Team Banana	945	1142	31.5																														25.6467715862387																																																								31.4974975151068																	
1	Victoria, MN USA	STROM Engineering/Crown Extrusions/Lean Partners/Lake Region Medical & Holy Famly	Fire	4207	1143	31.5																		31.4931895268319																																																																																					
2	Memphis, MI USA	Haacks Farm Greenhouses / FORMTECH / 2014 FRC Rookie Grant & Memphis High School	Jacked Up Jackets	5046	1144	31.407247543335																							27.9027054703902																																																																							31.407247531614									
1	Colorado Springs, CO USA	Sierra High School	Nightmare Robotics	1361	1145	31.3																																																																																			31.2762128897515																				
2	Portland, ME USA	Saunders Electronics / Robotics Institute of Maine & Cheverus High School	Cheverus	5265	1146	31.250452041626																					17.554961916603																																																																						31.2504518686691												
1	Spring Lake Park, MN USA	Spring Lake Park Lions Club / Lyle and Carole Ware / Medtronic / RMS Machining / Cummins Power Generation / jcpenney & Spring Lake Park High School	Panthinators	3699	1147	31.2																																																																31.2433667698213																																							
1	Cambridge, MN USA	Medtronic & Isanti County 4-H	Teens 'Nto Technology	3840	1148	31.2																		31.2108170075001																																																																																					
1	San Antonio, TX USA	NASA & Taft HS Robotics	RoboRaiders	3561	1149	31.2				31.2064929317686																																																																																																			
2	Brownsburg, IN USA	Rolls-Royce Corporation/WaterJet Cutting of Indiana/Indiana Workforce Development & Brownsburg High School	Purple Precision	3176	1150	31.2																																																-1.4038045600252																			31.1921434556647																																				
1	Baton Rouge, LA USA	Jacobs Engineering/jcpenney/Ingalls Shipbuilding & Parkview Baptist School	BulahBots!	3753	1151	31.2																																																																																						31.1871705438815																	
1	Little Falls, MN USA	Little Falls High School	Flyers	4623	1152	31.1																			31.0580932304915																																																																																				
2	Dallas, TX USA	Dell Computer / Deloitte & Science and Engineering Magnet High School	SEM	5057	1153	31.0	Newton																																		31.0425322735142																																																																				29.5846110351
1	Maryville, MO USA	Missouri Academy of Science, Mathematics, and Computing	Radical Tech	2167	1154	31.0																															31.0384826323564																																																																								
1	Crookston, MN USA	Pentair & Crookston High School	Pirates	3056	1155	31.0																			31.0255652715237																																																																																				
1	South Milwaukee, WI USA	Caterpillar / Columbia Grinding, Inc. / Dassault Systems SolidWorks Corp. & South Milwaukee High School	Rocket Robotics	3596	1156	31.0																																																			31.0204186455195																																																				
2	Newport, OR USA	Georgia-Pacific/Confederated Tribes of Siletz Indians & Newport High School	YAK Attack	2192	1157	31.0										24.4846037999445																																																																																					31.0126947019356								
2	Melbourne, FL USA	School Board of Brevard County/Rockwell Collins/Harris Corp/EDAK & Melbourne HS	Team Voltage	386	1158	31.0																														5.9995672419259																																																						31.0071214639829																			
1	Brandon, FL USA	jcpenney & Brandon Boys & Girls Club	Robo-Sharks	3557	1159	31.0																														30.9675560368346																																																																									
2	Union City, NJ USA	Union City Board of Education & Union City High School	UCHS MagneGeeks	3340	1160	31.0											15.553930671911																																30.9660620544252																																																												
2	Belvidere, IL USA	Chrysler Foundation/Motorola Solutions/UTC Aerospace/Belvidere Township/Best Buy Children's Foundation & Boone County 4-H	Flaming Monkeys	3352	1161	30.9		22.878035037109																																																																																			30.9344634897631																		
1	1304 Ashe Street, NC USA	jcpenney & The Boys & Girls Club of Henderson County	Robo Warriors	4245	1162	30.9282360076904																																	30.9282350990287																																																																						
1	Hidalgo, TX USA	American Electric Power/South Texas College Technology Campus/FIRST in Texas/Texas High School Project of Communities Foundation of Texas/D & F Industries, Inc. & Hidalgo Early College High School	Robot Commando Squad	3028	1163	30.9																																																																																										30.9218816334697													
2	Gaylord, MI USA	Gaylord High School	Team Trinity	5183	1164	30.9199981689453																																						14.7834422572696																30.9199985074128																																																	
2	Corry, PA USA	Al Xander Company, Inc/Corry Contract Inc/Corry Lumber Co./Corry Manufacturing Company/Corry Rubber Corporation/Great Lakes Manufacturing, Inc./Johnson Books & Stuff/Rossbacher Insurance Service/Tonnard Mfg. Corp. & Corry Area High School	CRT	306	1165	30.9																																																	14.0968209681438																				30.8932992783283																																		
2	Moffett Field, CA USA	NASA Ames Research Center/BAE Systems/St. Jude Medical Foundation/Stellar Solutions/Intuitive Surgical/Applied Welding/World Metal Finishing/Vivid-Hosting/Solidworks/Wildbit/Santa Clara University & Girl Scouts of Northern California	Space Cookies	1868	1166	30.9																													12.8634022958669																																																					30.8773419804738																					
2	whitmore lake, MI USA	Siemens / State of Michigan / NASA / Upright Rhombus / V Converter / Balance Technologies Inc. / RheTech & Whitmore Lake High School	TroBots	3668	1167	30.8																																							25.4242486510388																																		30.7656081201076																														
1	Centennial, CO USA	Lockheed Martin / Seakr Engineering / Career and Technical Education / CatCrib / SHARC & Eaglecrest High School	Raptacon	3200	1168	30.7																																																																																			30.7399539551889																				
1	Denton, TX USA	Texas Workforce Commission & Texas Academy of Mathematics and Science	TAMSformers	5212	1169	30.7285747528076																																			30.7285755170851																																																																				
1	Rogersville, TN USA	TVA/Baldor/Eastman & Cherokee High School	The Fellowship of the Springs	4264	1170	30.7																																																																						30.7176106138597																																	
2	Muskegon Heights, MI USA	Muskegon Heights High School PSA	Terrific Tigers	5255	1171	30.7093811035156																																																				30.7093805847472																						-13.4987868890302																													
2	Jackson, MI USA	Accubilt Inc. / Hurst Foundation / L.E. Warren ,Inc. / Chalgian @ Tripp Law / Consumers Energy / Alro Steel & East Jackson High School	BLUE OPS	4216	1172	30.6512203216553																								13.3023640638843															30.6512202527506																																																																
2	Shaker Heights, OH USA	University Hospitals Ahuja Medical Center / Rockwell Automation / Case Western Reserve University / NASA Glenn Research Center Educational Programs Office & Hathaway Brown School	Fighting Unicorns	2399	1173	30.6																																																	-3.2102850709606																																				30.6422600563405																		
1	Levittown, NY USA	Island Trees High School	ROBO-DAWGS	545	1174	30.6																																																																	30.6197609253543																																						
1	Chaska, MN USA	Lake Region Medical/Emerson Process Management & Chaska High School	Hawks	2531	1175	30.6																																																																30.5969655884104																																							
3	Port Huron, MI USA	The James C. Acheson Foundation / Port Huron Area School  District 21st Century Community Learning Centers / Cargill Salt / P.J. Wallbank Springs / Port Huron Hospital / Barch Designs / Huron Automatic Screw Co. / Peninsular Cylinder / Suburban Bolt / Trillium Automation, Inc. & Port Huron Area School District:	Mecanum Knights	3667	1176	30.6							3.2658371225693																																																																																					26.6557328539794					30.5880387455552						
2	Edmond, OK USA	Tinker Air force Base / Pratt & Whitney / Edmond Electric / Hadley Design / Edmond Public Schools & Edmond Memorial High School	IRONDOGZ	2773	1177	30.6																				30.5689198168461																																																25.6544027250426																																			
2	St laurent, QC Canada	Banque Nationale / CSMB / Fusion Jeunesse / MDA / Métro Somerled / Robotique FIRST Québec & École Saint-Laurent	Express-O	3986	1178	30.6														21.9971433164814																															30.5626894731433																																																										
2	Sag Harbor, NY USA	Ship Ashore Marina & Pierson High School	Pierson Whalers	28	1179	30.6	Curie																																																																30.5594311429425																																				29.6385295229024		
1	Kansas City, MO USA	North Kansas City School District & Winnetonka High School	PRIDE Robotics	5141	1180	30.5215396881103																															30.5215390832575																																																																								
1	Tulsa, OK USA	Dove Science Academy Tulsa	Fast and Serious	5001	1181	30.5																																																																				30.4677280953311																																			
2	Stamford, CT USA	NASA / United Technologies / Cyber Robotics Inc. / GE (General Electric) & Academy of Information Technology and Engineering High School	The Cyber Rams	3104	1182	30.435733795166																																																										30.4357338235622																				14.7024590749449																									
1	La Crescenta, CA USA	NASA Jet Propulsion Laboratory/DreamWorks Animation/WET & Crescenta Valley High School	Falkon Robotics	589	1183	30.4																30.3544578180391																																																																																							
1	Staten Island, NY USA	Port Authority of New York and New Jersey/JCC Beacon Program/BIMMY'S/Annadale Diner/Lee Ann Realty & Tottenville High School	Pyrobots	1396	1184	30.3																																																																																									30.3371829383721														
1	Fresno, CA USA	2014 FRC Hardship Grant & CHEFA	Metallic Thunder	3303	1185	30.3																						30.3134517124605																																																																																	
1	Magog, QC Canada	Armtex / Robotique FIRST Québec / 2014 FRC Rookie Grant / Conceptromex / Quais Bertrand / La Maison Olea / Wall-mart, Magog & École secondaire La Ruche	Les Carnicas	4952	1186	30.3																																													30.31097843653																																																										
1	Arlington, TX USA	Lockheed Martin/Mouser Electronics/Texas Workforce Commission/jcpenney & Martin High School	Warrior Robotics	3676	1187	30.3																																			30.3079435108206																																																																				
1	Lake City, MN USA	Medtronic/PTC/Pass It On/Hearth and Home Technologies/Goodhue County Co-op Electric & Lincoln High School (Lake City)	Infinity's End	2861	1188	30.3																																																															30.2710948836447																																								
1	Granite Falls, MN USA	Yellow Medicine East School District & Yellow Medicine East High School	YME Stingbots	3212	1189	30.2																			30.1735560577481																																																																																				
1	Jerusalem, JM Israel	The Hebrew University of Jerusalem- The Rachel and Selim Benin School of Computer Science and Engineering/Jerusalem municipality/Elephant & The Hebrew University Secondary School	Tiger Team, Leyada	2679	1190	30.2													30.1696974959444																																																																																										
2	Huntington, NY USA	2014 FRC Rookie Grant & Huntington High School	Devildroids	5016	1191	30.1	Newton																																																																4.063629813369																																						30.1367642472347
1	University City, MO USA	The Boeing Company & University City High School	Robolions	3397	1192	30.1																																30.1257481395818																																																																							
2	St. Louis, MO USA	The Boeing Company/The Doerr Family/HTE Technologies/HWP Rigging/Optimist Club of Clayton/Greater St. Louis Community Foundation/SIGN-A-RAMA/Southside Optimist Club/Emerson/SME-EF/Lindenwood Drugs/Ameren Missouri/Dino's Logistics, Inc & Bishop DuBourg High School	Cavaliers	2978	1193	30.1	Archimedes																															30.1229061094283																																																																				11.8225196584066			
2	Pewaukee, WI USA	GE Healthcare/QuadTech/Pewaukee High School Booster Club/Milwaukee School Of Engineering/Pewaukee Kiwanis/Dedicated Computing/Stanek Window Corporation/Coach USA Milwaukee/Ruekert-Mielke Engineering/Geiger Awards & Pewaukee High School	Paradigm Shift	1259	1194	30.1																			30.1138724498124																																25.3222994118223																																																				
1	Summerville, SC USA	The Boeing Company & Cane Bay High	Viper Drive	3490	1195	30.0969142913818			30.0969144891412																																																																																																				
3	Monroe, MI USA	PDS Plastics/Premier Industries/First Solar/Taylor Welded Blanks/Pioneer Metal Finishing/Lake Erie Fence Co./Cousineau DDS & Monroe County Community College	Virus	3547	1196	30.0								21.4653090992501																																																																		30.0081740699569																			13.244986288645										
3	Lake Oswego, OR USA	Mentor Graphics/Boeing/Intel/Veris Industries & Lake Oswego School District	Lake Monsters	2635	1197	30.0																									24.7461684329972																														29.9882663183693																																											19.0023895321048					
2	Lebanon, NH USA	CRREL & Lebanon High School	Grasshoppers	95	1198	30.0									26.0598751813787																																																																					29.9738984033698																									
2	Detroit, MI USA	Frontier International Academy	The Knights	5065	1199	30.0							29.9715864006451																																																																																						15.0957183718664										
2	Palo Alto, CA USA	The Boeing Company/Google/DreamWorks Animation & Palo Alto High School	The Vikings	8	1200	30.0																						15.956000088869																																																												29.9620009434885																					
2	Houston, TX USA	Humble ISD Education Foundation / NASA / CATE Center / Texas Workforce Commission / Briggs & Veselka Co. / Key Energy / Universal Pressure Pumping, Inc & Humble ISD AdamasBots	AdamasBots	4589	1201	29.9																																			0.9519183147402																																																							29.900293470745													
2	London, ON Canada	Mother Teresa Catholic Secondary School	The Spartans	5288	1202	29.8614616394043	Archimedes																																																																																13.7732734638584																			29.8614608774183			
1	Brooklyn, NY USA	Con Edison/Bezos Family Foundation & Thomas Jefferson High School Campus & High School For Civil Rights	ROBO KINGS AND QUEENS	1600	1203	29.9																																																																																									29.8506224005914														
1	Blythewood, SC USA	Westwood High School	Redhawks	5317	1204	29.8411254882812			29.8411255657028																																																																																																				
1	Sherwood, AR USA	AndyMark/Arkansas FIRST/Sarah Parsons Photography/Las Palmas Mexican Restaurant & LISA Academy-NLR	LAN Jaguars FIRST Robotics	4532	1205	29.8															29.7570433219446																																																																																								
1	Huntsville, AL USA	SAIC/Elk Lodge 1648/AUVSI, Pathfinders Chapter & Virgil I. Grissom High School	G.R.E.A.T. (Grissom Robotics Engineering Applications Team)	3319	1206	29.8																																																																																						29.7558756240623																	
2	Lake Odessa, MI USA	Lakewood High School	Vikings	5256	1207	29.619441986084																								29.6194421188251																																																																				10.3151451248721											
1	Poolesville, MD USA	NASA/jcpenney/PTC/Lockheed Martin/Cabcraft/Morningstar Welding/Bob's Bikes/Poolesville Hardware & Poolesville High School	Falcons FIRST	4099	1208	29.6																																																																							29.5753115251495																																
1	Sherbrooke, QC Canada	Robotique FIRST Québec & Le Salésien	SparTech	4942	1209	29.5																																													29.5429495780026																																																										
2	Philomath, OR USA	Autodesk/IBEW Local 280/Oregon Community Foundation/Dana Kepner Company/Gene Tools & Philomath High School	PHRED	847	1210	29.5																									18.3478000442581																																																																						29.5180216431329								
2	Sarnia, ON Canada	Ontario Power Generation/Conseil scolaire catholique Providence & Saint-Francois-Xavier High School	Le Vortex	1846	1211	29.5																																													18.25321861425																																				29.5005308133944																						
2	Quad Cities, IL USA	John Deere / McLaughlin Body Co. / 4H / SME & Rivermont Collegiate & Sherrard High School & Rock Island High School & Moline High School	QC ELITE	648	1212	29.5		29.4620641560011																																																																																			22.4909548409211																		
1	Gastonia, NC USA	TE Connectivity / Okuma / 4-H & Piedmont Community Charter School	Royal Robotics	3701	1213	29.4																																	29.4383288432273																																																																						
3	Berkley, MI USA	Terminal Supply / TARDEC / AMG Advanced Manufacturing Group / DADARA Ford Motor Company / Production Tool Supply / Autoliv / General Motors & Berkley High School & Hazel Park & Shrine Catholic High School	Da Bears	247	1214	29.3								29.3478907277796																																												3.3439270892376																																									20.7416881621889										
2	Lawrence, MI USA	Hinckley Research/Society of Plastics Engineers Western MI Section & Van Buren ISD	Tech Force	1254	1215	29.3																																																																										-4.1928639042168																		29.3392500233139											
1	Port Perry, ON Canada	Radioactive Hotspot / Signworks Canada / CARBODSKI / 2014 FRC Rookie Grant & Fast Eddie Community Robotics	Fast Eddie Community Robotics	5051	1216	29.3														29.3358279037472																																																																																									
2	West Branch, IA USA	NASA / Twinkle Co / Proctor and Gamble / Rev. & Mrs. Paulus / Kinze Manufacturing / Hills Bank and Trust / Liberty Communications / Aero Rental / Ed and Bev Spencer / New Pioneer Coop & West Branch High School	System Overlord Robotics	5041	1217	29.3	Archimedes	29.3145159172139																																																																																																		18.3098165859823			
2	montreal, QC Canada	Desjardins Caisse De Lorimier-Villeray / CAE / Fusion Jeunesse / Emballage CRE-O-PACK / Flexpipe / Robotique FIRST Québec / Outilpac / CSDM & Georges-Vanier	Scarabot	3988	1218	29.3														29.2719956499277																															10.6425059639018																																																										
2	Warrenton, VA USA	Highland Arts/Blaze Broadband/SiteWhirks/Ledo Pizza/The Willey Family/The McGill Family & Highland School	Team RoboHawk	3373	1219	29.2																																																		18.5342400118306																																					29.2164887796953																
1	Germantown, MD USA	Montgomery College / DAKOTA CONSULTING INCORPORATED / Booz Allen Hamilton / FJB Engineering & Northwest High School	Jagbots	4638	1220	29.2																																																																																							29.1805972739221																
2	Niles, MI USA	SRT/AEP/Honor Credit Union/Delta Machining/Dane Systems/PTC/Express One & Niles Community Schools	Team Fallout	3509	1221	29.2																																																																										29.1751027043544																			21.2586747020084										
2	Royal Oak, MI USA	Hitachi Automotive/Royal Oak Schools/OUR Credit Union/Kohl's & Royal Oak High School	Oaktown Crewz	1188	1222	29.1								8.3943149104764																															29.1469514847274																																																																
2	Ortonville, MN USA	University of Minnesota & Ortonville Public Schools	Midwest WARRIORS	3300	1223	29.1																		29.1198580841819																																	4.1022139120997																																																				
